{
  "name": "DeepTempo AI SOC Layer",
  "versions": {
    "attack": "14",
    "navigator": "4.9.1",
    "layer": "4.5"
  },
  "domain": "enterprise-attack",
  "description": "ATT&CK layer generated from DeepTempo findings",
  "techniques": [
    {
      "techniqueID": "T1071.001",
      "score": 93,
      "comment": "15 findings, avg conf 0.89",
      "enabled": true,
      "showSubtechniques": true
    },
    {
      "techniqueID": "T1573.001",
      "score": 75,
      "comment": "15 findings, avg conf 0.60",
      "enabled": true,
      "showSubtechniques": true
    },
    {
      "techniqueID": "T1071.004",
      "score": 87,
      "comment": "10 findings, avg conf 0.79",
      "enabled": true,
      "showSubtechniques": true
    },
    {
      "techniqueID": "T1190",
      "score": 92,
      "comment": "10 findings, avg conf 0.88",
      "enabled": true,
      "showSubtechniques": true
    },
    {
      "techniqueID": "T1048.003",
      "score": 67,
      "comment": "8 findings, avg conf 0.60",
      "enabled": true,
      "showSubtechniques": true
    },
    {
      "techniqueID": "T1021.002",
      "score": 77,
      "comment": "8 findings, avg conf 0.76",
      "enabled": true,
      "showSubtechniques": true
    },
    {
      "techniqueID": "T1018",
      "score": 66,
      "comment": "7 findings, avg conf 0.65",
      "enabled": true,
      "showSubtechniques": true
    },
    {
      "techniqueID": "T1059.001",
      "score": 52,
      "comment": "5 findings, avg conf 0.54",
      "enabled": true,
      "showSubtechniques": true
    },
    {
      "techniqueID": "T1059.003",
      "score": 36,
      "comment": "1 findings, avg conf 0.54",
      "enabled": true,
      "showSubtechniques": true
    }
  ],
  "gradient": {
    "colors": [
      "#ffffff",
      "#66b3ff",
      "#ff6666"
    ],
    "minValue": 0,
    "maxValue": 100
  }
}